{
  "release": "2026.8.12",
  "caseId": "case-research-a21",
  "familyId": "family-research-a21",
  "domain": "research",
  "operation": "synthesize",
  "difficulty": "complex",
  "task": {
    "instruction": "Synthesize a field-account approach. Treat the supplied records as the complete synthetic evidence set and make one selection for each declared decision.",
    "deliverable": "An account plan that assigns observation discretion or guidance, preserves comparability, and cites both records. Cite the named evidence references and do not list mutually incompatible selections."
  },
  "sourceDigest": "sha256:9c7e2bf2d9eb4f22f0cc124ca0df10a70cc1ab595c3584652afb3d922572423a",
  "evidence": [
    {
      "ref": "constraint-a21",
      "content": "The training card says volunteers may select observation positions, while the consistency note requires comparable count windows.",
      "digest": "sha256:43715a3c9cf936f56522a6c36c64df56216f1ad870b008ae69b8cdd44eb92fdd"
    },
    {
      "ref": "observation-a21",
      "content": "A made-up pond survey has field notes from experienced volunteers and a new observer; their counts differ at dusk but align at midday.",
      "digest": "sha256:f5291aa241c36f5b4f1d49a2bae59761cdb46d84d88adbc05831328e8a3ca53a"
    },
    {
      "ref": "scope-a21",
      "content": "This synthetic synthesize record for case-research-a21 is bounded to the named observation and constraint. A valid conclusion must distinguish them, cite both, and avoid an unstated factual claim.",
      "digest": "sha256:b2ebdf3b23745b2ad90f8a4a44f5902ae06ac45a7f77e3c63dfb9f0a91f2c3cb"
    }
  ],
  "perspectives": {
    "A": {
      "id": "agency-guidance-a",
      "pairId": "agency/guidance",
      "content": "When participants have the needed context, preserve their discretion over how to reach the declared outcome.",
      "digest": "sha256:ef6cc6f2faa1894ac57c2104b7b0f1dbef2d458c34b4ad26d76e7919251cf7ba"
    },
    "B": {
      "id": "agency-guidance-b",
      "pairId": "agency/guidance",
      "content": "When consistency or unfamiliarity matters, provide a clearer path and decision support toward the declared outcome.",
      "digest": "sha256:449eda0750c29040a5956b187060a20b120aa2a5b7295b7850f4d4f87431d475"
    },
    "irrelevant": {
      "id": "agency-guidance-irrelevant",
      "pairId": "irrelevant/file-naming",
      "content": "Use descriptive file names for any attached artifacts.",
      "digest": "sha256:02154c47bb6e71f1a134ddb9fac149ea3c8bdd189bd4c33c3954a452759ed3f7"
    }
  },
  "decisions": [
    {
      "decisionId": "research-a21-synthesize-judgment",
      "prompt": "Choose exactly one synthesize judgment for case-research-a21; justify it from the observation and constraint records rather than listing alternatives.",
      "regionOptions": [
        "assign positions through a guided count sequence",
        "let volunteers select positions within fixed count windows",
        "allow position choice under shared timing guardrails"
      ],
      "partition": "sensitive",
      "acceptedRegions": {
        "T0": ["allow position choice under shared timing guardrails"],
        "T1-A": ["let volunteers select positions within fixed count windows"],
        "T1-B": ["assign positions through a guided count sequence"]
      },
      "requiredEvidenceRefs": ["observation-a21", "constraint-a21"]
    },
    {
      "decisionId": "research-a21-evidence-scope",
      "prompt": "Choose the evidence practice that keeps the synthesize conclusion for case-research-a21 within the supplied record boundary.",
      "regionOptions": [
        "cite the named record bundle for a21",
        "replace the record bundle with an unstated conclusion for a21"
      ],
      "partition": "invariant",
      "acceptedRegions": {
        "T0": ["cite the named record bundle for a21"],
        "T1-A": ["cite the named record bundle for a21"],
        "T1-B": ["cite the named record bundle for a21"]
      },
      "requiredEvidenceRefs": ["observation-a21", "constraint-a21", "scope-a21"]
    }
  ],
  "nonGoal": "Do not identify species or a real pond. Do not replace the supplied record with an unstated factual conclusion."
}
