{
  "release": "2026.8.12",
  "caseId": "pcda-product-case-011",
  "familyId": "pcda-product-family-011",
  "domain": "product",
  "operation": "recommend",
  "difficulty": "standard",
  "task": {
    "instruction": "Recommend an intervention for failed invoice retries when both message clarity and retry scheduling contribute to recovery.",
    "deliverable": "A scoped recommendation, billing-protection invariant, and evidence citations."
  },
  "sourceDigest": "sha256:3cb2d6167ed51f1190056b4e7360da74cfc6c2e13547f43ca4a0307a3f27d12c",
  "evidence": [
    {
      "ref": "failure-codes",
      "content": "A synthetic sample attributes 58% of failures to expired payment details and 27% to temporary issuer rejection.",
      "digest": "sha256:9db6fa709283ba097f8da787e068f27bc35a984f24bb3c6d15694c77f0cfa806"
    },
    {
      "ref": "invariant-011",
      "content": "A synthetic billing invariant binds every retry to the original order transaction, requiring the system to prevent a second charge regardless of the chosen recovery pattern.",
      "digest": "sha256:70ddc8972fab4e6f6557ed634a67d2c9dc1a65ee89a2c135f2cbc7fccbb2e181"
    },
    {
      "ref": "recovery-pattern",
      "content": "Clearer messages recover expired-detail cases; spaced retries recover temporary rejections but increase notification volume.",
      "digest": "sha256:3d7861830988e9d144488609b618ed1e1c47eead5e2b8eb9b2c428258073f4fa"
    }
  ],
  "perspectives": {
    "A": {
      "id": "local-systems-a",
      "pairId": "local/systems",
      "content": "Prefer a bounded intervention at the immediate decision point when wider changes are not required by the evidence.",
      "digest": "sha256:9f1ab63dab599cfbd1e90d917f550d8a38c0ab908b103b85fb26ecca19be1831"
    },
    "B": {
      "id": "local-systems-b",
      "pairId": "local/systems",
      "content": "Prefer an intervention that accounts for connected incentives and downstream effects when the evidence shows they matter.",
      "digest": "sha256:0043d133ec80283c55d8d2d32b6a99d9758bfa5ea65b8c453bb38ab0c1056638"
    },
    "irrelevant": {
      "id": "local-systems-irrelevant",
      "pairId": "irrelevant/title-length",
      "content": "Keep the artifact title concise enough to fit on one line.",
      "digest": "sha256:0983700ec288937912c879a015b31619394fc1a58c4aed29100133720878528a"
    }
  },
  "decisions": [
    {
      "decisionId": "product-011-sensitive",
      "prompt": "What intervention scope should the recommendation favor?",
      "regionOptions": [
        "improve the expired-detail message at the failure screen",
        "pair message changes with retry timing and notification controls"
      ],
      "partition": "sensitive",
      "acceptedRegions": {
        "T0": [
          "improve the expired-detail message at the failure screen",
          "pair message changes with retry timing and notification controls"
        ],
        "T1-A": ["improve the expired-detail message at the failure screen"],
        "T1-B": [
          "pair message changes with retry timing and notification controls"
        ]
      },
      "requiredEvidenceRefs": ["failure-codes", "recovery-pattern"]
    },
    {
      "decisionId": "product-011-invariant",
      "prompt": "Which billing protection cannot change?",
      "regionOptions": [
        "permit parallel retries that can duplicate a charge",
        "prevent duplicate charges across all retries"
      ],
      "partition": "invariant",
      "acceptedRegions": {
        "T0": ["prevent duplicate charges across all retries"],
        "T1-A": ["prevent duplicate charges across all retries"],
        "T1-B": ["prevent duplicate charges across all retries"]
      },
      "requiredEvidenceRefs": ["invariant-011"]
    }
  ],
  "nonGoal": "Do not weaken duplicate-charge prevention."
}
