{
  "release": "2026.8.12",
  "caseId": "operations-a-recommend-complex-15-case",
  "familyId": "operations-a-recommend-complex-15-family",
  "domain": "operations",
  "operation": "recommend",
  "difficulty": "complex",
  "task": {
    "instruction": "Recommend a retention tier for records that support routine operations but may be needed to explain a rare high-impact decision.",
    "deliverable": "A tier recommendation with retrieval criteria, minimization boundary, and a review date."
  },
  "sourceDigest": "sha256:26cb1ff950124b62b4f13a1fad0a2012e35dec5fdc1a8e6c2c9e2fd4e592ac5b",
  "evidence": [
    {
      "ref": "brief/15",
      "content": "Routine records are queried weekly, while the rare decision requires linked snapshots and operator annotations to reconstruct context.",
      "digest": "sha256:12159b1fbb6e74ea05d70c44dbc9b19e3feb3f0025f7f121879208e9432edad6"
    },
    {
      "ref": "record/15",
      "content": "Long retention increases review burden, but short retention would lose the only baseline for two past decisions.",
      "digest": "sha256:5b54af426fe5b4c7a82b9d90cc55de9d54e0ec481a860f062215ad1437fbe1ef"
    }
  ],
  "perspectives": {
    "A": {
      "id": "reversible-committed-a",
      "pairId": "reversible/committed",
      "content": "When uncertainty remains, favor a choice that can be revised after new evidence without disproportionate cost.",
      "digest": "sha256:58bc5d4191b6efce4c0334a2165627906d9f02218d5a686cd8ba87fbe0d00b3d"
    },
    "B": {
      "id": "reversible-committed-b",
      "pairId": "reversible/committed",
      "content": "When coordination depends on certainty, favor a clear commitment with the resources needed to carry it through.",
      "digest": "sha256:8c49160a401692ca75ca056cc4a153a8d7742dd3ab8c2360ea68f52d27a15fea"
    },
    "irrelevant": {
      "id": "reversible-committed-irrelevant",
      "pairId": "irrelevant-summary-position",
      "content": "Place the concise summary before the supporting detail.",
      "digest": "sha256:86fba54b9edbea31f73cb27e08c818e654a855b8da697de66658037671c672dd"
    }
  },
  "decisions": [
    {
      "decisionId": "operations-a-recommend-complex-15-response",
      "prompt": "Which response region should govern evidence retention tier after weighing the supplied evidence?",
      "regionOptions": [
        "hold-recommend-15",
        "recommend-a-bounded-long-retention-tier-for-linked-decision-records-only-15",
        "recommend-the-standard-tier-with-a-scheduled-snapshot-for-high-impact-decisions-15",
        "retain-high-impact-snapshots-deeply-and-routine-records-briefly-15"
      ],
      "partition": "sensitive",
      "acceptedRegions": {
        "T0": ["hold-recommend-15"],
        "T1-A": [
          "recommend-the-standard-tier-with-a-scheduled-snapshot-for-high-impact-decisions-15"
        ],
        "T1-B": [
          "recommend-a-bounded-long-retention-tier-for-linked-decision-records-only-15"
        ]
      },
      "requiredEvidenceRefs": ["brief/15", "record/15"]
    },
    {
      "decisionId": "operations-a-recommend-complex-15-record",
      "prompt": "Which evidence-recording rule must remain fixed while choosing the response for evidence retention tier?",
      "regionOptions": [
        "preserve-access-logging-deletion-authority-and-record-provenance-15",
        "record-review-15"
      ],
      "partition": "invariant",
      "acceptedRegions": {
        "T0": [
          "preserve-access-logging-deletion-authority-and-record-provenance-15"
        ],
        "T1-A": [
          "preserve-access-logging-deletion-authority-and-record-provenance-15"
        ],
        "T1-B": [
          "preserve-access-logging-deletion-authority-and-record-provenance-15"
        ]
      },
      "requiredEvidenceRefs": ["brief/15", "record/15"]
    }
  ],
  "nonGoal": "Do not retain unrelated personal or identifying details."
}
