{
  "release": "2026.8.12",
  "caseId": "operations-a-recommend-complex-14-case",
  "familyId": "operations-a-recommend-complex-14-family",
  "domain": "operations",
  "operation": "recommend",
  "difficulty": "complex",
  "task": {
    "instruction": "Recommend an allocation rule for one constrained processing lane when two request classes have different urgency, reversibility, and downstream coupling.",
    "deliverable": "A rule recommendation with an exception boundary, tie-breaker, and worked application to the evidence."
  },
  "sourceDigest": "sha256:0912b92886f643e350248fb6cd8e1d30dfe9c0284adc5ad2cb95c4259089233b",
  "evidence": [
    {
      "ref": "brief/14",
      "content": "Class Copper has urgent deadlines but reversible work; Class Ivory has less urgency but a downstream dependency that cannot be paused safely.",
      "digest": "sha256:df29ea578ba09068fd6f4eb8f3ecb34a762224b4864b34103375d4099d3eff19"
    },
    {
      "ref": "record/14",
      "content": "The lane can process only one class per cycle, and a missed Ivory cycle causes three linked reviews to wait.",
      "digest": "sha256:a8448be763721cc16b15c2fef0b58de7e10cad87d0201eb8b3169e37c48e374a"
    }
  ],
  "perspectives": {
    "A": {
      "id": "breadth-depth-a",
      "pairId": "breadth/depth",
      "content": "When coverage is the limiting need, represent the important range of cases before adding detail to any one case.",
      "digest": "sha256:647551f13672a2a474cddfdf775bab7400dd4e162ba93df0052323a12fd75f8c"
    },
    "B": {
      "id": "breadth-depth-b",
      "pairId": "breadth/depth",
      "content": "When understanding is the limiting need, examine the pivotal case deeply before extending coverage.",
      "digest": "sha256:657fea21964c8b6427724e121ceee29f6d7dcf7b3b67a61ef1b549bdfa13ab01"
    },
    "irrelevant": {
      "id": "breadth-depth-irrelevant",
      "pairId": "irrelevant-spacing",
      "content": "Use consistent spacing between sections in the final artifact.",
      "digest": "sha256:110d8f2f49d8a5ffffcec452bea51470b890f37d9a9cabb66bb9b19a7dd0cd20"
    }
  },
  "decisions": [
    {
      "decisionId": "operations-a-recommend-complex-14-response",
      "prompt": "Which response region should govern allocation rule after weighing the supplied evidence?",
      "regionOptions": [
        "hold-recommend-14",
        "cover-both-request-classes-with-a-protected-share-and-published-exception-14",
        "trace-the-pivotal-ivory-dependency-before-allocating-the-next-cycle-14",
        "reserve-a-small-slice-for-whichever-class-would-create-the-larger-queue-14"
      ],
      "partition": "sensitive",
      "acceptedRegions": {
        "T0": ["hold-recommend-14"],
        "T1-A": [
          "cover-both-request-classes-with-a-protected-share-and-published-exception-14"
        ],
        "T1-B": [
          "trace-the-pivotal-ivory-dependency-before-allocating-the-next-cycle-14"
        ]
      },
      "requiredEvidenceRefs": ["brief/14", "record/14"]
    },
    {
      "decisionId": "operations-a-recommend-complex-14-record",
      "prompt": "Which evidence-recording rule must remain fixed while choosing the response for allocation rule?",
      "regionOptions": [
        "publish-the-same-eligibility-owner-and-exception-fields-for-each-class-14",
        "record-review-14"
      ],
      "partition": "invariant",
      "acceptedRegions": {
        "T0": [
          "publish-the-same-eligibility-owner-and-exception-fields-for-each-class-14"
        ],
        "T1-A": [
          "publish-the-same-eligibility-owner-and-exception-fields-for-each-class-14"
        ],
        "T1-B": [
          "publish-the-same-eligibility-owner-and-exception-fields-for-each-class-14"
        ]
      },
      "requiredEvidenceRefs": ["brief/14", "record/14"]
    }
  ],
  "nonGoal": "Do not rank requests by volume or requester familiarity."
}
