{
  "release": "2026.8.12",
  "caseId": "case-projection",
  "familyId": "family-projection",
  "domain": "writing",
  "operation": "summarize",
  "difficulty": "standard",
  "task": {
    "instruction": "Choose one region for each decision using the evidence and any supplied perspective.",
    "deliverable": "Write /app/output.json with the declared decision manifest and a concise evidence-grounded response."
  },
  "sourceDigest": "sha256:e1a989f57dfb509ab22c86b86e0ebbcb6595bd33f549e5401645f5c6adaf06a9",
  "evidence": [
    {
      "ref": "calendar",
      "content": "A two-hour focus block ends thirty minutes before an optional meeting.",
      "digest": "sha256:038c7884781c6ef05906b547c38cd922eae76b748f7d0dc56eef4ee0aa61b965"
    },
    {
      "ref": "notes",
      "content": "The summary must cite the supplied source material.",
      "digest": "sha256:559cf03e4fc27c36a1a673a625e126ac9deeb270033a5c9a08e3182b2598049e"
    }
  ],
  "perspectives": {
    "A": {
      "id": "perspective-focus-a",
      "pairId": "perspective-pair-focus",
      "content": "Protect uninterrupted work blocks and move optional meetings when deadlines are near.",
      "digest": "sha256:73d14b437fd9955f51f40775764357fba137d7b13c3121a2fc14a9930af077d5"
    },
    "B": {
      "id": "perspective-focus-b",
      "pairId": "perspective-pair-focus",
      "content": "Use optional meetings to align early when coordination risk is high.",
      "digest": "sha256:0d1cbf770dcb185e3fc432c6fa59ff02abaed066f927f223d82e60f5047c5e38"
    },
    "irrelevant": {
      "id": "perspective-irrelevant",
      "pairId": "perspective-pair-irrelevant",
      "content": "Prefer short written updates before recurring status meetings.",
      "digest": "sha256:8f24cd050a46fb6d2e9d28b8c6f638743205df18bc2fdbcce552e5d323709e65"
    }
  },
  "decisions": [
    {
      "decisionId": "focus",
      "prompt": "How should the work block be handled?",
      "regionOptions": ["neutral", "preserve-focus", "attend-meeting"],
      "partition": "sensitive",
      "acceptedRegions": {
        "T0": ["neutral"],
        "T1-A": ["preserve-focus"],
        "T1-B": ["attend-meeting"]
      },
      "requiredEvidenceRefs": ["calendar"]
    },
    {
      "decisionId": "sources",
      "prompt": "How should the supporting material be handled?",
      "regionOptions": ["cite-sources", "omit-sources"],
      "partition": "invariant",
      "acceptedRegions": {
        "T0": ["cite-sources"],
        "T1-A": ["cite-sources"],
        "T1-B": ["cite-sources"]
      },
      "requiredEvidenceRefs": ["notes"]
    }
  ],
  "nonGoal": "Do not infer real-person preferences."
}
