{
  "release": "2026.8.12",
  "caseId": "pcda-product-case-026",
  "familyId": "pcda-product-family-026",
  "domain": "product",
  "operation": "plan",
  "difficulty": "standard",
  "task": {
    "instruction": "Plan a roadmap cycle for a product team split between improving repeat use and opening a new collaboration mode.",
    "deliverable": "A sequenced roadmap plan, invariant reliability budget, and evidence."
  },
  "sourceDigest": "sha256:986954a7b1379ca205db07ad5cba57750ef9fc34ca18613ed7a1f9255db4b387",
  "evidence": [
    {
      "ref": "capacity-boundary",
      "content": "The cycle can fund two discovery spikes or one production-ready direction while reserving the fixed reliability budget.",
      "digest": "sha256:89880ed79045ef1eb8ace12051fba2d8daa6ba11452254e273d30b4caec12d34"
    },
    {
      "ref": "demand-signals",
      "content": "Synthetic requests are evenly split: 34 ask for repeat-use shortcuts and 33 ask for asynchronous collaboration.",
      "digest": "sha256:437fa5f3f136a5b994ed50f9aeb94fcd7c96099f29514cac6e5b774825539f3c"
    },
    {
      "ref": "invariant-026",
      "content": "A synthetic planning charter reserves one quarter of every cycle for reliability work; the choice between discovery spikes and a production direction occurs only within the remaining capacity.",
      "digest": "sha256:33a8bccca4fdfad0a52b16a6b3b39a554c498fd10c90cb68b498f6e7ee313451"
    }
  ],
  "perspectives": {
    "A": {
      "id": "exploration-convergence-a",
      "pairId": "exploration/convergence",
      "content": "When uncertainty is material, preserve room to compare distinct hypotheses before narrowing the choice.",
      "digest": "sha256:5ccc1c7766896675f653f27dbe36ae02279e2990a024670a9a360da35ae64e62"
    },
    "B": {
      "id": "exploration-convergence-b",
      "pairId": "exploration/convergence",
      "content": "When evidence is sufficient, narrow the choice and direct effort toward one coherent course of action.",
      "digest": "sha256:3037c8cf8ca432ea8ceee62297c071a1bfb70da59b1511606b322c832bb464db"
    },
    "irrelevant": {
      "id": "exploration-convergence-irrelevant",
      "pairId": "irrelevant/date-format",
      "content": "Use one consistent date format throughout the deliverable.",
      "digest": "sha256:e81068d824a8b4782b821782116e6ea6cdf489bd2fe2391a07d55b56c1a72b6f"
    }
  },
  "decisions": [
    {
      "decisionId": "product-026-sensitive",
      "prompt": "How should the plan allocate product discovery?",
      "regionOptions": [
        "select repeat-use shortcuts as the single cycle direction",
        "run two bounded spikes with a shared decision date"
      ],
      "partition": "sensitive",
      "acceptedRegions": {
        "T0": [
          "run two bounded spikes with a shared decision date",
          "select repeat-use shortcuts as the single cycle direction"
        ],
        "T1-A": ["run two bounded spikes with a shared decision date"],
        "T1-B": ["select repeat-use shortcuts as the single cycle direction"]
      },
      "requiredEvidenceRefs": ["demand-signals", "capacity-boundary"]
    },
    {
      "decisionId": "product-026-invariant",
      "prompt": "Which capacity reservation cannot move?",
      "regionOptions": [
        "consume the reliability budget for feature discovery",
        "reserve one quarter of the cycle for reliability work"
      ],
      "partition": "invariant",
      "acceptedRegions": {
        "T0": ["reserve one quarter of the cycle for reliability work"],
        "T1-A": ["reserve one quarter of the cycle for reliability work"],
        "T1-B": ["reserve one quarter of the cycle for reliability work"]
      },
      "requiredEvidenceRefs": ["invariant-026"]
    }
  ],
  "nonGoal": "Do not spend the reliability reservation."
}
