{
  "release": "2026.8.12",
  "caseId": "case-research-a12",
  "familyId": "family-research-a12",
  "domain": "research",
  "operation": "recommend",
  "difficulty": "standard",
  "task": {
    "instruction": "Recommend a marking method. Treat the supplied records as the complete synthetic evidence set and make one selection for each declared decision.",
    "deliverable": "A recommendation with one method, a test or adoption step, and record citations. Cite the named evidence references and do not list mutually incompatible selections."
  },
  "sourceDigest": "sha256:e9539f48a6b1bba0668ee32e09070b29c0b08605acf0086fbd23fb450c8772e8",
  "evidence": [
    {
      "ref": "constraint-a12",
      "content": "The trial sheet records one successful wax-mark test, while the archive guide documents the older pencil convention.",
      "digest": "sha256:9c312c1807b6cc3a9dcdec6850b27bced228d3d5a306cf4f3485d067d0a4490d"
    },
    {
      "ref": "observation-a12",
      "content": "A fictional estuary map exercise needs a method for marking temporary sediment bars; the current stencil smears on damp paper.",
      "digest": "sha256:74b585fa387924842a7edf570a0c61a17b268fe1a13d0c25e2f9cb3a406c2b67"
    },
    {
      "ref": "scope-a12",
      "content": "This synthetic recommend record for case-research-a12 is bounded to the named observation and constraint. A valid conclusion must distinguish them, cite both, and avoid an unstated factual claim.",
      "digest": "sha256:0f02f51ff430e585b77268c1418f8d63e4c49e76133f191e8343d94db9cff338"
    }
  ],
  "perspectives": {
    "A": {
      "id": "novelty-precedent-a",
      "pairId": "novelty/precedent",
      "content": "When existing patterns do not fit the stated constraints, prefer a new approach whose risks can be tested explicitly.",
      "digest": "sha256:6436d147872630cea3dc550a9447f6653055339ec9c7f90f790b2f65bd5e55e9"
    },
    "B": {
      "id": "novelty-precedent-b",
      "pairId": "novelty/precedent",
      "content": "When a proven pattern fits the stated constraints, prefer its established behavior and known operational costs.",
      "digest": "sha256:238b2216af2fd2cf56aa86a4921f78f42e1252280cbd073dc3685dd9b49940e8"
    },
    "irrelevant": {
      "id": "novelty-precedent-irrelevant",
      "pairId": "irrelevant/list-style",
      "content": "Use parallel grammar for items in the final list.",
      "digest": "sha256:f5d11a4db862bc9d896c1093f7db73f35900d5e92dda43b0d6340da8db5ab352"
    }
  },
  "decisions": [
    {
      "decisionId": "research-a12-recommend-judgment",
      "prompt": "Choose exactly one recommend judgment for case-research-a12; justify it from the observation and constraint records rather than listing alternatives.",
      "regionOptions": [
        "compare one wax mark against the familiar convention",
        "reuse the archived pencil convention",
        "trial a wax-mark variant on damp paper"
      ],
      "partition": "sensitive",
      "acceptedRegions": {
        "T0": ["compare one wax mark against the familiar convention"],
        "T1-A": ["trial a wax-mark variant on damp paper"],
        "T1-B": ["reuse the archived pencil convention"]
      },
      "requiredEvidenceRefs": ["observation-a12", "constraint-a12"]
    },
    {
      "decisionId": "research-a12-evidence-scope",
      "prompt": "Choose the evidence practice that keeps the recommend conclusion for case-research-a12 within the supplied record boundary.",
      "regionOptions": [
        "replace the record bundle with an unstated conclusion for a12",
        "cite the named record bundle for a12"
      ],
      "partition": "invariant",
      "acceptedRegions": {
        "T0": ["cite the named record bundle for a12"],
        "T1-A": ["cite the named record bundle for a12"],
        "T1-B": ["cite the named record bundle for a12"]
      },
      "requiredEvidenceRefs": ["observation-a12", "constraint-a12", "scope-a12"]
    }
  ],
  "nonGoal": "Do not identify a real waterway. Do not replace the supplied record with an unstated factual conclusion."
}
