{
  "release": "2026.8.12",
  "caseId": "case-alpha",
  "familyId": "family-alpha",
  "domain": "writing",
  "operation": "summarize",
  "difficulty": "medium",
  "task": {
    "instruction": "Choose one region for each decision.",
    "deliverable": "Return the declared decision manifest."
  },
  "evidence": [
    {
      "ref": "source-alpha",
      "content": "Synthetic evidence for alpha.",
      "digest": "sha256:a98bb75cecc477dc58c38e07343deb099215454020159ce941083dcf56d822b1"
    }
  ],
  "perspectives": {
    "A": {
      "id": "perspective-alpha-a",
      "pairId": "perspective-pair-alpha",
      "content": "Prefer direct treatment.",
      "digest": "sha256:e4358b6d64a3dc70f7d14965c8745e94bc45782e9fc636c488315535148adbed"
    },
    "B": {
      "id": "perspective-alpha-b",
      "pairId": "perspective-pair-alpha",
      "content": "Prefer contextual treatment.",
      "digest": "sha256:c895eb71e2d05d74a1756c560c619dd4683af3fa93b055a2c202839c9bc7a6cd"
    },
    "irrelevant": {
      "id": "perspective-alpha-irrelevant",
      "pairId": "perspective-pair-alpha-irrelevant",
      "content": "Prefer concise updates.",
      "digest": "sha256:948c34c9cd4b2b9aae443163e82c227ec9e7ad28597057c032cab8eff51a173c"
    }
  },
  "decisions": [
    {
      "decisionId": "sensitive-alpha",
      "prompt": "Which treatment should be used?",
      "regionOptions": ["draft", "direct", "contextual"],
      "partition": "sensitive",
      "acceptedRegions": {
        "T0": ["draft"],
        "T1-A": ["direct"],
        "T1-B": ["contextual"]
      },
      "requiredEvidenceRefs": ["source-alpha"]
    },
    {
      "decisionId": "invariant-alpha",
      "prompt": "Which evidence bound should be preserved?",
      "regionOptions": ["cite", "bounded", "omit"],
      "partition": "invariant",
      "acceptedRegions": { "T0": ["cite"], "T1-A": ["cite"], "T1-B": ["cite"] },
      "requiredEvidenceRefs": ["source-alpha"]
    }
  ],
  "nonGoal": "Do not invent sources.",
  "sourceDigest": "sha256:a4d9b59bfc90e261b09d6b6d1acbe8230c2811d9d09ec19496b354624fcf957b"
}
