{
  "release": "2026.8.12",
  "caseId": "pcda-product-case-020",
  "familyId": "pcda-product-family-020",
  "domain": "product",
  "operation": "synthesize",
  "difficulty": "standard",
  "task": {
    "instruction": "Synthesize prototype evidence for replacing a conventional filter list with a query-building canvas.",
    "deliverable": "A synthesis recommendation, fixed result-integrity rule, and evidence citations."
  },
  "sourceDigest": "sha256:e293cc2794e8d013a70470a555be1397e543d798b1b72e70bb119dfd2c5d07e4",
  "evidence": [
    {
      "ref": "invariant-020",
      "content": "A synthetic export-transparency rule requires the active filter logic to be shown before results are exported, regardless of whether the query uses a list or canvas interface.",
      "digest": "sha256:d784931c773bef409d8cd2b1ce1d89b2c8bcbddab3dd49a0520164f530b9d586"
    },
    {
      "ref": "maintenance-note",
      "content": "The list uses an established component; the canvas needs a two-cycle validation of keyboard behavior and saved queries.",
      "digest": "sha256:ca7cfeb2f19c5c0fa387ead496796ca092ac9818ae083745745dd8b8d9acbd17"
    },
    {
      "ref": "prototype-test",
      "content": "In synthetic tests, specialists solve nested queries 40 seconds faster on the canvas; occasional users make fewer errors with the list.",
      "digest": "sha256:003842b0bb332fc703428549fec7d34832e64057af7f4e39f7ba420cfb3a96f9"
    }
  ],
  "perspectives": {
    "A": {
      "id": "novelty-precedent-a",
      "pairId": "novelty/precedent",
      "content": "When existing patterns do not fit the stated constraints, prefer a new approach whose risks can be tested explicitly.",
      "digest": "sha256:6436d147872630cea3dc550a9447f6653055339ec9c7f90f790b2f65bd5e55e9"
    },
    "B": {
      "id": "novelty-precedent-b",
      "pairId": "novelty/precedent",
      "content": "When a proven pattern fits the stated constraints, prefer its established behavior and known operational costs.",
      "digest": "sha256:238b2216af2fd2cf56aa86a4921f78f42e1252280cbd073dc3685dd9b49940e8"
    },
    "irrelevant": {
      "id": "novelty-precedent-irrelevant",
      "pairId": "irrelevant/list-style",
      "content": "Use parallel grammar for items in the final list.",
      "digest": "sha256:f5d11a4db862bc9d896c1093f7db73f35900d5e92dda43b0d6340da8db5ab352"
    }
  },
  "decisions": [
    {
      "decisionId": "product-020-sensitive",
      "prompt": "Which design direction should the synthesis advance?",
      "regionOptions": [
        "retain the conventional filter list as the default pattern",
        "advance the query canvas as a tested specialist mode"
      ],
      "partition": "sensitive",
      "acceptedRegions": {
        "T0": [
          "advance the query canvas as a tested specialist mode",
          "retain the conventional filter list as the default pattern"
        ],
        "T1-A": ["advance the query canvas as a tested specialist mode"],
        "T1-B": ["retain the conventional filter list as the default pattern"]
      },
      "requiredEvidenceRefs": ["prototype-test", "maintenance-note"]
    },
    {
      "decisionId": "product-020-invariant",
      "prompt": "Which result rule is invariant?",
      "regionOptions": [
        "show the active filter logic before results are exported",
        "export results without disclosing active filters"
      ],
      "partition": "invariant",
      "acceptedRegions": {
        "T0": ["show the active filter logic before results are exported"],
        "T1-A": ["show the active filter logic before results are exported"],
        "T1-B": ["show the active filter logic before results are exported"]
      },
      "requiredEvidenceRefs": ["invariant-020"]
    }
  ],
  "nonGoal": "Do not export results without their active filter logic."
}
