{
  "release": "2026.8.12",
  "caseId": "operations-a-plan-complex-29-case",
  "familyId": "operations-a-plan-complex-29-family",
  "domain": "operations",
  "operation": "plan",
  "difficulty": "complex",
  "task": {
    "instruction": "Plan recovery across three connected cells after a shared handoff failed, balancing a reversible local restart against a coordinated systems check.",
    "deliverable": "A recovery sequence with dependency gates, observation points, rollback actions, and owner handoffs."
  },
  "sourceDigest": "sha256:8413978d9baa4d186a19799d102bfd37ee191e7b1f284ea96fbd6d926ef32c07",
  "evidence": [
    {
      "ref": "brief/29",
      "content": "Cell Fern can restart locally without data loss; Cell Glow has a stale queue; Cell Reed depends on a shared acknowledgment that did not arrive.",
      "digest": "sha256:7a3539f5184af37db6a6c9d4c7e1e71ebfd5f69a58493f6cfd33a8bc49463d67"
    },
    {
      "ref": "record/29",
      "content": "The dependency map shows a local restart may clear Fern but could hide the missing acknowledgment needed by Reed.",
      "digest": "sha256:ed4b9a025817ee0acdad76750099ded846ba3b37dee55922d8ae5f3dabfb9e3a"
    }
  ],
  "perspectives": {
    "A": {
      "id": "agency-guidance-a",
      "pairId": "agency/guidance",
      "content": "When participants have the needed context, preserve their discretion over how to reach the declared outcome.",
      "digest": "sha256:ef6cc6f2faa1894ac57c2104b7b0f1dbef2d458c34b4ad26d76e7919251cf7ba"
    },
    "B": {
      "id": "agency-guidance-b",
      "pairId": "agency/guidance",
      "content": "When consistency or unfamiliarity matters, provide a clearer path and decision support toward the declared outcome.",
      "digest": "sha256:449eda0750c29040a5956b187060a20b120aa2a5b7295b7850f4d4f87431d475"
    },
    "irrelevant": {
      "id": "agency-guidance-irrelevant",
      "pairId": "irrelevant/file-naming",
      "content": "Use descriptive file names for any attached artifacts.",
      "digest": "sha256:02154c47bb6e71f1a134ddb9fac149ea3c8bdd189bd4c33c3954a452759ed3f7"
    }
  },
  "decisions": [
    {
      "decisionId": "operations-a-plan-complex-29-response",
      "prompt": "Which response region should govern cross-cell recovery after weighing the supplied evidence?",
      "regionOptions": [
        "hold-plan-29",
        "let-cell-owners-choose-bounded-restarts-within-shared-acknowledgment-gates-29",
        "follow-a-central-dependency-runbook-before-authorizing-any-cell-restart-29",
        "restart-fern-under-a-watch-while-holding-the-shared-acknowledgment-gate-29"
      ],
      "partition": "sensitive",
      "acceptedRegions": {
        "T0": ["hold-plan-29"],
        "T1-A": [
          "let-cell-owners-choose-bounded-restarts-within-shared-acknowledgment-gates-29"
        ],
        "T1-B": [
          "follow-a-central-dependency-runbook-before-authorizing-any-cell-restart-29"
        ]
      },
      "requiredEvidenceRefs": ["brief/29", "record/29"]
    },
    {
      "decisionId": "operations-a-plan-complex-29-record",
      "prompt": "Which evidence-recording rule must remain fixed while choosing the response for cross-cell recovery?",
      "regionOptions": [
        "keep-cell-state-dependency-state-and-rollback-owner-separate-29",
        "record-review-29"
      ],
      "partition": "invariant",
      "acceptedRegions": {
        "T0": [
          "keep-cell-state-dependency-state-and-rollback-owner-separate-29"
        ],
        "T1-A": [
          "keep-cell-state-dependency-state-and-rollback-owner-separate-29"
        ],
        "T1-B": [
          "keep-cell-state-dependency-state-and-rollback-owner-separate-29"
        ]
      },
      "requiredEvidenceRefs": ["brief/29", "record/29"]
    }
  ],
  "nonGoal": "Do not declare cross-cell recovery complete when only Fern is healthy."
}
